{
  "schemaVersion": 1,
  "registryId": "openblock-esp32-pilot",
  "generator": "external-resources-v3/scripts/generate-block-registry.js",
  "source": {
    "repo": "external-resources-v3",
    "commit": "d6356ce90c7655807ebf77eb69f9c91a057c896e"
  },
  "extensionCount": 19,
  "blockCount": 80,
  "extensions": [
    {
      "extensionId": "espBme280",
      "name": "BME280",
      "version": "1.0.1",
      "supportDevices": [
        "microPythonEsp32",
        "microPythonEsp8266"
      ],
      "programModes": [
        "realtime",
        "upload"
      ],
      "bundledLibrary": "lib",
      "official": true,
      "tags": [
        "sensor"
      ],
      "blocks": [
        {
          "opcode": "espBme280_altitude",
          "shape": "reporter_number",
          "args": [],
          "pythonMapping": {
            "available": true,
            "kind": "expression",
            "imports": [],
            "libraries": [],
            "setups": [],
            "variables": []
          },
          "safety": []
        },
        {
          "opcode": "espBme280_humidity",
          "shape": "reporter_number",
          "args": [],
          "pythonMapping": {
            "available": true,
            "kind": "expression",
            "imports": [],
            "libraries": [],
            "setups": [],
            "variables": []
          },
          "safety": []
        },
        {
          "opcode": "espBme280_init",
          "shape": "statement",
          "args": [
            {
              "name": "SDA",
              "kind": "dropdown",
              "dynamicOptions": "device_pins",
              "allowedValues": null,
              "default": "21",
              "fallbackValues": [
                "21",
                "22",
                "4",
                "5"
              ]
            },
            {
              "name": "SCL",
              "kind": "dropdown",
              "dynamicOptions": "device_pins",
              "allowedValues": null,
              "default": "22",
              "fallbackValues": [
                "21",
                "22",
                "4",
                "5"
              ]
            }
          ],
          "pythonMapping": {
            "available": true,
            "kind": "statement",
            "imports": [
              "from machine import Pin, I2C",
              "import bme280"
            ],
            "libraries": [],
            "setups": [
              "espBme280"
            ],
            "variables": []
          },
          "safety": []
        },
        {
          "opcode": "espBme280_pressure",
          "shape": "reporter_number",
          "args": [],
          "pythonMapping": {
            "available": true,
            "kind": "expression",
            "imports": [],
            "libraries": [],
            "setups": [],
            "variables": []
          },
          "safety": []
        },
        {
          "opcode": "espBme280_temperature",
          "shape": "reporter_number",
          "args": [],
          "pythonMapping": {
            "available": true,
            "kind": "expression",
            "imports": [],
            "libraries": [],
            "setups": [],
            "variables": []
          },
          "safety": []
        }
      ]
    },
    {
      "extensionId": "espBuzzer",
      "name": "Buzzer Music",
      "version": "1.1.2",
      "supportDevices": [
        "microPythonEsp32",
        "microPythonEsp8266"
      ],
      "programModes": [
        "realtime",
        "upload"
      ],
      "bundledLibrary": null,
      "official": true,
      "tags": [
        "actuator"
      ],
      "blocks": [
        {
          "opcode": "espBuzzer_playFreq",
          "shape": "statement",
          "args": [
            {
              "name": "PIN",
              "kind": "dropdown",
              "dynamicOptions": "device_pins",
              "allowedValues": null,
              "default": "4",
              "fallbackValues": [
                "4",
                "21",
                "22"
              ]
            },
            {
              "name": "FREQ",
              "kind": "input",
              "check": null,
              "default": null
            },
            {
              "name": "DUR",
              "kind": "input",
              "check": null,
              "default": null
            }
          ],
          "pythonMapping": {
            "available": true,
            "kind": "statement",
            "imports": [
              "from machine import Pin, PWM",
              "import time"
            ],
            "libraries": [
              "espBuzzer_helpers"
            ],
            "setups": [],
            "variables": []
          },
          "safety": [
            "actuator"
          ]
        },
        {
          "opcode": "espBuzzer_playNote",
          "shape": "statement",
          "args": [
            {
              "name": "PIN",
              "kind": "dropdown",
              "dynamicOptions": "device_pins",
              "allowedValues": null,
              "default": "4",
              "fallbackValues": [
                "4",
                "21",
                "22"
              ]
            },
            {
              "name": "NOTE",
              "kind": "dropdown",
              "dynamicOptions": null,
              "allowedValues": [
                "262",
                "294",
                "330",
                "349",
                "392",
                "440",
                "494",
                "523",
                "587",
                "659",
                "698",
                "784",
                "880",
                "988",
                "1047"
              ],
              "default": "262"
            },
            {
              "name": "DUR",
              "kind": "input",
              "check": null,
              "default": null
            }
          ],
          "pythonMapping": {
            "available": true,
            "kind": "statement",
            "imports": [
              "from machine import Pin, PWM",
              "import time"
            ],
            "libraries": [
              "espBuzzer_helpers"
            ],
            "setups": [],
            "variables": []
          },
          "safety": [
            "actuator"
          ]
        },
        {
          "opcode": "espBuzzer_rest",
          "shape": "statement",
          "args": [
            {
              "name": "DUR",
              "kind": "input",
              "check": null,
              "default": null
            }
          ],
          "pythonMapping": {
            "available": true,
            "kind": "statement",
            "imports": [
              "import time"
            ],
            "libraries": [],
            "setups": [],
            "variables": []
          },
          "safety": [
            "actuator"
          ]
        },
        {
          "opcode": "espBuzzer_stop",
          "shape": "statement",
          "args": [
            {
              "name": "PIN",
              "kind": "dropdown",
              "dynamicOptions": "device_pins",
              "allowedValues": null,
              "default": "4",
              "fallbackValues": [
                "4",
                "21",
                "22"
              ]
            }
          ],
          "pythonMapping": {
            "available": true,
            "kind": "statement",
            "imports": [
              "from machine import Pin, PWM",
              "import time"
            ],
            "libraries": [
              "espBuzzer_helpers"
            ],
            "setups": [],
            "variables": []
          },
          "safety": [
            "actuator"
          ]
        }
      ]
    },
    {
      "extensionId": "espDht",
      "name": "DHT",
      "version": "1.0.1",
      "supportDevices": [
        "microPythonEsp32",
        "microPythonEsp8266"
      ],
      "programModes": [
        "realtime",
        "upload"
      ],
      "bundledLibrary": null,
      "official": true,
      "tags": [
        "sensor"
      ],
      "blocks": [
        {
          "opcode": "espDht_read",
          "shape": "reporter_number",
          "args": [
            {
              "name": "TYPE",
              "kind": "dropdown",
              "dynamicOptions": null,
              "allowedValues": [
                "11",
                "22"
              ],
              "default": "11"
            },
            {
              "name": "PIN",
              "kind": "dropdown",
              "dynamicOptions": "device_pins",
              "allowedValues": null,
              "default": "4",
              "fallbackValues": [
                "4",
                "5",
                "21",
                "22"
              ]
            },
            {
              "name": "DATA",
              "kind": "dropdown",
              "dynamicOptions": null,
              "allowedValues": [
                "temperature",
                "humidity"
              ],
              "default": "temperature"
            }
          ],
          "pythonMapping": {
            "available": true,
            "kind": "expression",
            "imports": [
              "from machine import Pin",
              "import dht",
              "import time"
            ],
            "libraries": [
              "espDht"
            ],
            "setups": [],
            "variables": []
          },
          "safety": []
        }
      ]
    },
    {
      "extensionId": "espDs18b20",
      "name": "DS18B20",
      "version": "1.1.2",
      "supportDevices": [
        "microPythonEsp32",
        "microPythonEsp8266"
      ],
      "programModes": [
        "realtime",
        "upload"
      ],
      "bundledLibrary": null,
      "official": true,
      "tags": [
        "sensor"
      ],
      "blocks": [
        {